{"schema":"nrm.customer.navigation_report.v1","messageId":"nav-001","timestamp":"2026-08-13T10:00:00+08:00","source":"CUSTOMER","data":{"runId":"run-demo","simTime":10.0,"platformId":"aircraft-01","navigationType":"INTEGRATED","truthPosition":{"latitudeDeg":34.1,"longitudeDeg":108.9,"altitudeM":8000},"perceivedPosition":{"latitudeDeg":34.10001,"longitudeDeg":108.89999,"altitudeM":8002},"positionErrorM":{"inTrack":1.2,"crossTrack":-0.8,"vertical":2.0},"status":"GPS1","confidence":"HIGH"}}
